פדרמן במכתב לאיגוד: התנהגות אוהדי הפועל מבישה	1
בועות: מה ג'רי סיינפלד הבטיח אחרי שסיים את ההופעות בישראל?	2
"מכבי ת""א הודיעה: וויצ'יץ' - המנהל המקצועי"	2
בועות: אביב אלוש ואבי לוי חוגגים	0
המנצחים והמפסידים של השבוע	2
העובדים בדרום יפוצו על אובדן ימי עבודה	0
"רפי שדה מונה למנכ""ל רשת מלונות דן"	0
פדרמן מחליף את ההנהלה של סקיילקס	2
בועות: הג'וב החדש של אלכסה צ'אנג	2
קמפיין למתחתנים הערביים בגמר היורו. רכילות עסקית	2
2011: כ-22 מיליון לינות תיירים במלונות בישראל	0
אחרי 8 שנים: סוף לסכסוך בין פדרמן ושטראוס	0
"תוכנית: תוספת של 5,000 חדרי מלון ב-5 שנים"	0
"מחפשים עבודה? במלונות חסרים ‭4,000‬ עובדים"	2
חשד: עדנה לב תקפה שוטרים	1
המאחז שבות עמי פונה; המתנחלים: נקים מחדש	1
שרון קורא לבכירי המשק לקדם ממשלת אחדות לאומית	2
פיתוח ישראלי יבטיח שמיים נקיים מעל הכנסת	0
מזל טוב: שרונה פיק התחתנה	0
ההשקעה של קנדי קראש. רכילות עסקית	2
"סוף עידן: מוני פנאן החליט לפרוש ממכבי ת""א"	1
"אנדי רם: קיימו את אליפות ישראל ע""ש אבי"	2
"אסירים יהודים לבג""ץ: שחררו אותנו בחילופי השבויים"	1
המלונאים נושמים לרווחה: קציר המלח נכון והגיוני	0
בכירי המשק לאולמרט: לא להרחיב את התקציב	2
שפיטה מופיעה בפני בכירי שטראוס ובנק הפועלים	2
"כדאי להשקיע? מחירי הנדל""ן בדרום ת""א יזנקו"	2
"התאחדות המלונות: ""המלון יקר? תבואו בחורף"""	2
"מי הפך את מרכז פרס ליזם נדל""ן?"	2
רמי שביט מציג ספורט ורעיה	2
שיר לשירה בסימפונית	2
יגאל עמיר ביקש לצאת לברית של בנו	2
"""בשנה הבאה ניפטר מהערבים, בעזרת השם"""	1
רשת מלונות דן: רווח נקי של כ-4 מיליון שקל ברבעון	0
"ירידה במלונות במאי: ""סימני המצב הגאופוליטי"""	1
שואו מי דה מאני: כמה מוציא תייר בישראל?	2
שמיים סגורים: מ-5:00 בבוקר יקורקעו טיסות	1
יפו לאמידים: 50 דירות חדשות ייבנו בשד' ירושלים	2
בועות	2
"ראשון: אשדוד בראשון לציון, ברק נתניה בנשר"	2
"מיסז'ניקוב מסכם קדנציה: ""לא טעיתי בכלום"""	2
יום הקולנוע הישראלי חוזר: סרטים ב-10 שקלים	2
בגלל מצרים? זינוק במספר לינות התיירים בארץ	2
נופשים יקרים: למה נופש באילת יקר יותר מבפריז?	2
ולנסיה ליורוליג: הענישו את מכבי על שלטי בן לאדן	2
"""אבא לא ראה את האביב"": סיפורי מדליקי המשואות ביום השואה"	2
"קייטנה מהסרטים: הצטרפו ליום הכיף של ""ידיעות אחרונות"" ו־ynet"	0
הרבנות למלונות: אין להגיש תאנים; חשש לחרקים	1
פרשת פנאן: גיא גודס ו-וילי סימס נחקרו	1
"ארמוזה הוזמן, פדרמן הסתובב"	2
"עמוס פרישמן: ""דייויד פדרמן אמר ששמעון מזרחי נמצא בניגוד עניינים"""	2
בועות	2
עוד יוזמה ברוכה נולדה	2
"מתחמם המרוץ: עוד מועמדים לתפקיד היועמ""ש"	2
המכירות הלוהטות של סוף השבוע	0
נופש אחר בישראל	2
"""בזכות יצחק נבון התחברתי לשורשים שלי"""	2
"מחזאים בכירים דורשים להופיע בפני ועדת ""הבימה"""	2
ארבעים וחמש מלכות	2
כשלבנה זוהרים פגשה את קובי וטליה	2
מארינה מקסימיליאן חושפת בטן של חודש שמיני	2
משוב השופטים: גרוניס ונאור אחרונים בעליון	2
חברות התרופות נאבקות על המונופול	1
הו דה פאק איז ג'ינה?	2
תפקיד חייה: גילה אלמגור חגגה חתונת זהב	0
איפה אוכלים בגליל העליון?	2
"""נתינה לאנשים שנמצאים בקו האש זו מצווה"""	2
אחרי התקף-לב: איך מתבצע השיקום והחזרה לשגרה	1
לא בגלל אשתי	2
המדריך	2
קלולס מבקרת בשמורת החולה	2
מפגש הביצה: איפה בילו טהוניה ועידן יניב?	2
המועמדים לפרס התיאטרון: הקאמרי מוביל	2
הזוגות שלקחו את הצעת הנישואים למקסימום	2
העלוקה בשישי	2
מני מזוז ברשימת המועמדים של ביניש לעליון	2
הלילה החשוף ביותר של קרן פלס	2
אחרי הפרידה: אושרת קוטלר עובדת על קאמבק	2
"דרוש: מנכ""ל ל""הבימה"""	2
שותפות לשמחה: כשמירי רגב פגשה את גילה אלמגור	0
יצאו לאור: דליה מזור ואלכס גלעדי ביחד	2
נפטרה הרוצחת שהסעירה את המדינה	1
ילדיו של קירשנבאום או זוגתו: איך תחולק הירושה	2
למי חגגה יעל בר זוהר?	2
"אישום: הטרדה מינית ב""הבימה"""	1
יום לפני הפתיחה: כל הכרטיסים לתיאטרונטו אזלו	2
משרדי עורכי הדין המובילים בישראל. המצעד	2
בנו של דן מרידור ימונה לתפקיד בכיר באוצר	0
ארוחת בוקר פלוס לילה	2
זכרונות מהכוורת ומתכונים נוטפי דבש	2
לפני הזמן: נחום מנבר שמכר נשק לאיראן משוחרר	1
ספר חדש למתחילים: כך תלמד להיות הורה	0
"דילן, הנדריקס ו... גבסו?"	2
משיקים קאמבק: הראל סקעת ועידן רול ביחד	0
תיאטרון הרצליה מציג - המשבר הגדול	1
"משפחתו של יעקב אגמון חוששת שיפוטר מגל""צ: ""השפלה של אדם בן 88"""	1
"תושבי שיכון דן נדחו: תמ""א 38 תימשך בת""א"	1
קנסות נמוכים למפירים - תמריץ לזיוף משחקים?	1
שבת משפחתית: למי חגגה יעל בר זוהר?	2
"מנכ""ל ""דלק מוטורס"" ועובד בכיר עוכבו לחקירה"	1
"ים של דמעות: לירונה מתה, הקרב על החוף נמשך"	1
שוחרר ממעצרו חשוד בתקיפה מינית של 19 ילדים	0
נדחתה התביעה הייצוגית נגד יצרנית קליה	1
חתונה אופנתית: בר רפאלי חוגגת עם החברה	0
אנחות יסוד	2
9 על 9: תשעה פרצופי תשעה באב	2
80 רגעים מופלאים בטבע בארץ ובעולם	2
בועות: ג'ניפר סנוקל ועופר טלקר מציגים	2
מיתוג מחדש: HOT תחליף את שמה לאלטיס - כמו החברה האם	0
פטריק דרהי רוכש את בית המכירות הפומביות סותבי'ס תמורת 3.7 מיליארד דולר	0
"אלטיס, בעלת HOT הישראלית, נקנסה ב־124.5 מיליון אירו בשל עבירה על חוקי ההגבלים האירופיים"	1
מירס מפטרת עשרות עובדים	1
"דרהי: ""לא אכפת לי להיות שחקן מספר 2"""	2
i24NEWS יחל את שידוריו בישראל	2
"זעזוע בהוט: המנכ""ל אילן צחי פורש אחרי שנה וחצי, טל גרנות־גולדשטיין תחליף אותו"	1
בעלי הוט רכש בית מכירות פומביות בניו יורק ביותר משלושה מיליארד דולרים	0
"מנכ""ל מירס, אברשה בורשטיין, יפרוש בסוף השנה"	1
ראש בראש: דרהי ובן דב נלחמים על 012 סמייל	2
מכרז הסלולר: חברת סלקט תחליף את אקספון	2
דרהי ינסה להגיע לאחזקה של כ-66% במניות הוט	0
"כחלון: ""הוזלה בסלולר - הכוח עובר ללקוח"""	0
במירס רוצים לשלם פחות על רישיון הסלולר	2
מתחדשת: קבוצת HOT מחליפה לוגו ונפרדת מהבועה האדומה אחרי 12 שנה	0
"מנכ""ל מירס: הכישלון של חזי בצלאל היה צפוי"	1
בכיר בחברה האם של HOT: ישראל עושה בית ספר לעולם	0
ההפתעה של הוט: גולן טלקום תתארח על התשתית שלה	0
הממשלה אישרה את מכירת מירס	0
הבורסה ננעלה בעליות; HOT זינקה ב-14%	0
בנק לאומי מוכר את אחזקותיו ב-HOT	1
עושים כבוד לפטריק דרהי	0
חברות הסלולר החדשות: מירס ו-018 אקספון	2
נמחקה העתירה נגד בחירת המפעיל הסלולר ה-5	0
"סטלה הנדלר, יו""ר HOT, פורשת מתפקידה"	1
הוט מובייל תפטר 40 עובדי מכירות ומטה	1
הושלמה מכירת מירס לפטריק דרהי	1
"לא עוד ""הוט"""	2
אנשי עסקים בכנס מיניות בריאה. רכילות עסקית	2
פלאפון וסלקום מתחרות על מירס	2
"נטישת הלקוחות לא נפסקת, גם בטריפל: הרווח הנקי של הוט צלל ברבעון ב־95%"	0
רכילות עסקית: תורמות ומצטלמות למען נשים מוכות	0
הקרב נגמר: צ'רטר קונה את טיים וורנר כייבל	0
"הוט: יותר לקוחות בטריפל, התחזקות בסלולר"	0
HOT: רווח נקי של 18 מיליון שקל	0
"רשמית: סטלה הנדלר תמונה למנכ""לית בזק"	2
נוקיה סימנס תקים את רשת הסלולר של מירס	0
פטריק דרהי רוכש את כייבל ויז'ן האמריקנית	0
חזי בצלאל הגיש הצעה לרכישת השליטה במירס	0
הקרב על מירס נכנס לישורת האחרונה	2
אלוביץ' מכר את מניותיו ב-HOT לדרהי	1
"9,000 מנויים עזבו את שירותי הטלוויזיה והאינטרנט של הוט ברבעון השלישי"	1
הרבעון של הוט: רווח נקי של 18 מיליון ש'	0
HOT מציגה: שנה של מהפכה וחזרה להובלה	0
פטריק דרהי רוכש את מירס בכ-170 מיליון דולר	0
תשובה יוצא מ-HOT: מכר 75% מאחזקותיו לדרהי	1
המפעילים החדשים: נוריד מחירי הסלולר ב-30%	2
כשבראבא פגש את סנדרסון	2
שיבושים ברווחי החברה	1
גובה ההצעות לרכישת מירס - אכזבה למוטורולה	1
הוט מסכמת את 2016: עלייה של 2% בהכנסות שהסתכמו ב-4.05 מיליארד שקל	0
וול סטריט ננעלה בירידות; טבע זינקה ב-8%	0
רכילות עסקית: פרזנטוריות של בריאות	2
המדריך	2
אל על משיקה	2
מחאת אנשי החינוך והאקדמיה - המכתב המלא	1
מעונות הסטודנטים: יש הרבה מה לשפר	2
המדריך	2
המדריך	2
נערך טקס הענקת פרס דניאלי לרופאים ולאחיות	2
הכדורסל (לא) שייך לצעירים	2
"אוחיון יושיע? מכבי ת""א הפסידה גם לבאמברג"	2
"קוראים ומשחקים: אירועי יריד הספרים הבינ""ל"	2
אנחנו דור נעלם	2
ההשקעה של קנדי קראש. רכילות עסקית	2
המדריך	2
"אורי פפר: ""הטלוויזיה שלנו במצב קשה"""	1
הוראות סריגה לבגד ים מדליק	1
צו הרחקה לפדרמן: קילומטר מבית האוגדונר	1
"באלדוצ'י: ""מקל ישחק במכבי. בורשטיין? לא יודע"""	2
"פדרמן: ""בלאט יכול היה להוציא יותר מהשחקנים"""	2
"ביהמ""ש למדינה: יש לכם 3 ימים להאשים את טלי פחימה"	2
עיין ערך מלומד	2
"ברקוביץ' חתם במכבי ת""א: באתי לקחת דאבל"	2
"אחרי העימות: פלסטינים הותקפו, מבנה חדש הוקם"	1
בנו של וורן באפט נחת בארץ במפתיע	0
"בתוך עשור: 1,000 מקומות עבודה חדשים בגליל"	0
משפחות העושר בישראל	2
ליצמן חוזר לכיסא המנהל	0
ריבלין קורא לגלות את ירושלים	0
מדינת ישראל חוגגת 58 שנים	0
כמה שוות הבנות של סטף ורטהיימר?	2
אומגה בפה ועל היד	2
"נשים בגיל המעבר: חושבות על מין, מקיימות פחות"	2
בועות: נמרוד משיח עובר לפיתוח אפליקציות	2
קרן נועה אשכול תמשיך בפעילותה	2
מיליון וחצי שקלים לשניידר	2
מרגלית מחדש את מנהטן	2
חיים הכט לראשות הממשלה	2
בועות: קולקצייה חדשה ללילך אלגרבלי	2
רשימת הנכסים של המיליארד איתן ורטהיימר	2
"""חוב המיליונים"" של ורטהיימר התכווץ"	2
כך פספסנו את המימונה הייקית (אבל אפשר לתקן)	2
ברק חסך תשלום מס של 7 מיליון שקל	0
נכנס יין	2
נקודת מגע: מוזיאון ישראל המחודש חוגג שנה	0
מי לוקחת בתחרות השמלה השחורה הקטנה?	2
רגל קרושה ודובדבנים אדומים: סוף שבוע במטולה	2
רוני דנקנר מכר את ביתו בארסוף ב-8 מיליון דולר	1
תחרות העסקים הקטנים: צפו בזוכים	0
בועות	2
"אגדת הפלמ""ח גידי אילת הלך לעולמו"	1
הבית של הברקים נמכר ב-3.5 מיליון דולר	1
הסיפורים מאחורי העסקים המשפחתיים של בעלי ההון	2
שופט אסר על סטף ורטהיימר להיכנס לוילה שבנה	1
העלוקה בשישי	2
אלברטו קונטאדור יבקר בישראל בחודש דצמבר	2
משפחת שטראוס לא תמכור מניותיה בקרוב	0
200 אלף דולר מעיר המלאכים למריומה	0
פועלים למען הציבור: זוכי פרס רוטרי	0
הגשמת החלום וסגירת מעגל	0
מיזם האופניים הגדול שיעזור לפתח את התיירות בגליל	0
13 תעשייניות ב-70 שנה: הנשים הבודדות בעולם של גברים	1
"ביה""ח בנהריה נגד רגב: ""סטירת לחי, גם למנהל מגיע להשיא משואה"""	2
שנת צדקה: נתינה עם חיבוק שווה יותר	0
חמש קטנות על התוכנית לצמצום הזיהומים  בבתי החולים | עם רעיה שטראוס בן־דרור	2
בלעדי: אי.סי.איי עומדת לפטר מאות עובדים	1
ירושלים של מעלה: רמי לוי יבנה מגדלים בגבעת שאול	0
שני פצועים קל בפיגוע ירי ליד מאחז בבנימין	1
אי סי איי טלקום נמכרה תמורת 1.2 מיליארד דולר	1
"רמב""ם: תוך יומיים - שני תינוקות בלעו סוללות"	1
"אייל עופר בראש: אלה 21 הישראלים העשירים ביותר בעולם עפ""י פורבס"	2
"אי.די.בי ודסק""ש ירוויחו עד 170 מיליון ש' מהנפקת GVT"	0
בעלי המניות ב-ECI אישרו את מכירתה לקבוצת שאול שני	1
תביעת מתן נאור': שאול איזנברג ושי שני לחקירה	1
עוד שני מטוסי דרימליינר של אל על בדרך לישראל	0
דיווח ברוסיה: שני מציע למדבדב לרכוש את ECI	0
פרק 3: הפמליה	2
"זהבה שאול: ""כל מה שאמרתי על ראש הממשלה אמת"""	2
הושלמה עסקת הרכישה של חברת אי סי איי טלקום	0
שני האחים תרמו כליה לזרים. האח השלישי בהמתנה	0
מטח לעבר רכב: שני פצועים בפיגוע בשומרון	1
"למסירה: שני סניפים של מגה, כולל אשראי"	2
חיילים במרצ: למה לא נותנים לנו להצביע בפריימריז?	2
"מופז נגד בתי המשפט, סיבוב שני"	2
"שאול ""המלך"" מזרחי נפטר בגיל 81"	1
ראש המוסד למיזמים מיוחדים	2
שופט גילה שהחשוד רעב - ויצא להביא חטיף	1
"הרצל שאול בראיון לפני מותו: ""אולי טעינו שחיכינו שנתיים בלי לצעוק"""	1
"""בנק לאומי – הטוב בישראל ב־2016"""	0
"משפחת גולדין מגיבה לדיווחים: ""מתאמצים לשכנע את הממשלה לשנות את המשוואה"""	2
שני חיילים נהרגו בהתקפה על מחסום המנהרות	1
בעקבות סערת מפעל הפיס - שני שופטי פרס ספיר התפטרו	1
"עובדי ECI הפגינו נגד הבעלים: ""פיטורי נוחות"""	1
פרשת בזק: מעצרו של שאול אלוביץ' הוארך עד יום שני	1
"המשנה למנכ""ל והסמנכ""ל ב-ECI פורשים"	1
"הפועל ת""א בגמר. אייזנברג: ""מבחינתנו אנחנו אלופים"""	2
שני אחים נפצעו בפיצוץ רכב בדרום תל אביב	1
"""אני כבר לא יכול להחזיק"". עדות מהלילה הדרמטי בכינרת"	1
"רשות ני""ע בברזיל חוקרת את עסקת מכירת GVT"	1
נוחי דנקנר ושלמה דוברת מוכרים את ECI לשאול שני	1
ECI מתכוננת לגל פיטורים: כ-300 יעזבו	1
פועלים-השקעות תמנה 2 דירקטורים מטעמה בנייס	0
אקזיט המיליארדים: איך שאול שני עשה את זה?	0
"""רוסאטום הרוסית במו""מ לרכישת חלקים מ-ECI"""	0
"שני קיבוצניקים לשעבר קנו את האולם של ה""אוסקר"""	0
"דדו, בר-לב וכל השאר: זכרונות משאול ביבר"	2
שני צעירים נהרגו בתאונה באזור אשדוד	1
"מקורבי הלוחמים מנצח יהודה: ""לא היו צריכים לשמור על מי שסייע להרוג את חבריהם"""	1
הותר לפרסום: שני ישראלים מוחזקים בעזה	1
בדרך לכתבי אישום חמורים: לוחמים הכו פלסטינים ותיעדו	1
"הילדה מהפיגוע ב""אפרופו"" מתגייסת"	0
"בן-שאול יישאר יו""ר משאב"	2
"מביהמ""ש לביה""ס: בני הזוג שהפכו למורים"	2
eci תפטר כ-150 עובדים במהלך השבוע	1
"מאיר שני מונה למנכ""ל כלל תעשיות"	0
"עד המדינה מהבר נוער: ""יש לי הוכחות לגבי שני מעורבים ברצח"""	2
אחרי המאבקים והפיטורים: נחתם הסכם קיבוצי ב-ECI	2
"מאיר שני צפוי להתמנות למנכ""ל כלל תעשיות"	2
אנטרקוט מטורף ועגבניות פראיות: אייל שני חוזר למטבח	0
המנצחים והמפסידים של השבוע	2
זה המורה שנגע בילדות	1
דנקנר השלים מכירת מניות שופרסל לברונפמן-פישר	0
"""בית החולים רעד, תפסתי את שני התינוקות בידיים ורצתי"". עדות של אב שחזר מנפאל"	1
"אלוביץ' וחפץ ש""שותק ולא משתף פעולה"" יישארו במעצר"	1
עלתה למקום ה-1: עזריאלי החברה הכי מזהמת	1
רכילות עסקית: גיא גיאור רוקד על כל החתונות	2
מכרז בזק: שרון יכריע השבוע בסוגיית פראנס-טלקום	2
קופיקס בקניוני עזריאלי ובדיזנגוף סנטר	2
"דוד עזריאלי חוגג 90: ""מקווה לעוד הרבה שנים"""	2
גלידה גרסת קיץ 2019	2
עזריאלי זה לא רק קניון	2
אורי גלר הפך את הכפית של מייקל ג'קסון לקסדת מלחמת הכוכבים	2
ראש הממשלה ושרת החינוך יצאו יחד לתיאטרון	2
פסטיבל האביב הבינלאומי של ראשון לציון חוזר	2
החורף לא בא - בקניוני עזריאלי יוצאים במבצע	0
"ארדן: ""שוטר אלים לא יישאר בשורות המשטרה"""	1
"יוצאי אתיופיה מחו במשך שעות בת""א, 10 נעצרו"	1
"הקניון החדש ברמלה: בלי זארה, עם h&m"	1
תל אביב: כובתה השריפה במגדלי עזריאלי	0
עזריאלי מרפד את ילדיו: יקבלו 60% מהמניות	0
טלי שרון חזרה לאקס	0
"יו""ר חברת החשמל יפתח רון טל נשאר צמוד לכלבתו - גם בישיבות הדירקטוריון"	2
אדום בוהק: רשת LAKA נמכרה לישראל צברי	2
קיץ על הגובה: אטרקציה על גג עזריאלי	1
"השב""כ ממליץ: להוציא את פראנס טלקום מההתמודדות"	2
צופים מגג העולם	2
סיכום 2004: הקהל חזר לקניונים	2
"""גם ליוצאי אתיופיה בפרדס כץ מגיע בית חם"""	2
"פעם הייתי עו""ד, היום אני בעלת קונדיטוריה"	2
סניפי רשתות: לא מקבלים בקבוקים למחזור בשישי ובערב חג	1
הכירו את האנשים מאחורי מותגי-העל של Superbrands	2
"שרון: ""הפיגוע בקריה - תוצאה של הסתת הרשות"""	1
דנה עזריאלי	2
"יום סוער: ""המערכת הכי רצינית מתחילת העונה"""	1
"מחוץ לפרוטוקול: מי נבחרה למפקחת מטעם האו""ם, ומי הפיק כנס משפטי לעולים מדרום אפריקה ואוסטרליה?"	2
ותן טל ומטריה	2
"דירה בת""א במחיר 3 באירופה: כדאי להשקיע?"	2
"קובי פרץ: ""עברתי משומן כבש לחזה עוף"""	0
"""יום קניות מטורף"": מפת העסקים שפתוחים בישראל בשבת"	0
בקרוב: מדד חברות משפחתיות בבורסה	2
"קבוצת קסטרו-הודיס יוצאת מ-5 קניוני עזריאלי ""אנחנו מתחילים צונאמי"""	1
3 חודשים לאסון הכרמל – 81 כבאים לפני פיטורים	1
ככה פותחים פסטיבל	2
"המו""מ פוצץ: עזריאלי לא קונה את שרונה מרקט"	1
שהטרור יקפוץ להם: אמני הפארקור משתלטים על ישראל	1
בועות: המרדף של הקיבוצים אחרי הקנאביס	1
שעת': שרון המנהיג החזק והמסוכן מאז בן גוריון	1
מרכז עזריאלי: המגדל השלישי בדרך	2
"הערב מגיעים תושבי הדרום להפגין בת""א: ""יצא המרצע מן השק"""	2
"ישראל סוערת: קניון מודיעין הוצף, נזק כבד לרכוש"	1
לאומי תורם ספרים על השואה לספריות עירוניות	0
אופנת רחוב	2
"מחאה בעוצמה פחותה: הפגנות בת""א ובקריית אתא"	1
"""שרון הוא זמני - שא-נור לא"""	2
"אלוף הפיקוד: ""לא תהיה פאניקה ברעש אדמה"""	1
כנס בצפון: אדמות המדינה נגזלות בידי ערבים	2
"מקס סטוק, מאחורייך"	2
"שריפה בקניון איילון, הקהל פונה מהקולנוע"	1
האם חשיפת התיק הרפואי גרמה נזק לקמפיין?	1
אסף זמיר מוקיר את מדריכי הפסגות	0
להסיר את הסיר	2
"50 אלף דולר לראש, פגישות בבית גיל הזהב: כתבי אישום חמורים בפרשת מוסלי"	2
שווארמות? שרון אוהבת לאפות	2
מתנחלים עם לפטופ	2
"שרי אריסון: מקום 57 בעולם, ומה בישראל?"	2
שרי אריסון מתגאה בבן	0
רמי לוי הציע מסלול סלולר בשקל - סלקום ופרטנר ירדו בבורסה	2
"שרי אריסון קנתה פנטהאוז בת""א ב-13 מיליון דולר"	0
איקאה תקים חנות שלישית בצפון עם שרי אריסון	0
תושבים בבני ציון: שרי אריסון חסמה רחוב לכבוד יום הולדתה	1
השנה הקשה של שרי אריסון	1
"שרי אריסון: ""לא היתה לנו ברירה אלא לפטר"""	1
אחרי שני עשורים: שרי אריסון תיפרד מהפועלים	1
שרי אריסון שבה ומשקיעה בבנק הפועלים	0
אשה שלישית שוקלת להתלונן נגד בעלה של שרי אריסון	1
שרי אריסון מוכרת מחצית ממניותיה בבנק הפועלים - תמורת 3.25 מיליארד שקל	1
"ארה""ב: שרי אריסון קיבלה תואר ד""ר של כבוד"	0
האם שרי אריסון ידעה?	2
שרי אריסון תקים קניון ענק בקריית-אתא	0
ג'ייסון אריסון	2
הנשים העשירות בעולם: שרי אריסון מקום 6	2
שרי אריסון מכרה מניות קרניבל-קרוז ב-28  מ' ד'	1
שרי אריסון לא מוכרת בשלב זה מחצית מאחזקותיה בבנק הפועלים	2
שרי אריסון וצביקה פיק תובעים את גינדי החזקות על ליקויי בנייה במגדל השופטים	1
